
ID;typeName;typeDescription
2a7b6a5d-0f1e-4c8e-8c28-b3a2b2a2a4c1;Biological Aggregate;Returns indicative of living organisms moving in groups or schools (e.g., pods, shoals, coordinated movement, dispersal when startled).
9f0c3d21-6d43-4f2a-bc6a-9f5f5a1b7c2e;Artificial/Wreckage;Metallic resonance, twisted or jagged structures, debris fields, or echoes consistent with man-made objects and wreckage.
f3b2c1a9-1e7a-4a5f-9e2d-6a8f4c3b1d0e;Geological Structure;Stable contours and formations such as ridges, caverns, dunes, rock lattices, layered deposits, or dome-like/maze-like natural patterns.
0e4a1c6b-8f7d-4a83-a5b9-2d3f1e6c7a5b;Signal/Interference;Acoustic artifacts including rhythmic or mechanical pulses, static bursts, harmonic tones, or refraction leading to unpredictable bounces.
7c5e2d1a-93f0-4e7b-8c6d-1ab2c3d4e5f6;Unknown/Mysterious;Anomalous or ambiguous readings lacking a clear biological, artificial, or geological explanation (e.g., sudden voids, persistent unexplained signals or formations).
